Ether / IP / TCP 162.159.136.234:https > 192.168.69.247:35054 PA / Raw
Ether / IP / TCP 162.159.136.234:https > 192.168.69.247:35054 PA / Raw
Ether / IP / TCP 192.168.69.247:35054 > 162.159.136.234:https A
Ether / IP / TCP 162.159.136.234:https > 192.168.69.247:35054 PA / Raw
Ether / IP / TCP 162.159.136.234:https > 192.168.69.247:35054 PA / Raw
Ether / IP / TCP 162.159.136.234:https > 192.168.69.247:35054 PA / Raw
Ether / IP / TCP 192.168.69.247:35054 > 162.159.136.234:https A
Ether / IP / TCP 162.159.136.234:https > 192.168.69.247:35054 PA / Raw
Ether / IP / TCP 192.168.69.247:35054 > 162.159.136.234:https A
Ether / IP / TCP 162.159.136.234:https > 192.168.69.247:35054 PA / Raw
Ether / IP / TCP 162.159.136.234:https > 192.168.69.247:35054 PA / Raw
Ether / IP / TCP 192.168.69.247:35054 > 162.159.136.234:https A
Ether / IP / TCP 162.159.136.234:https > 192.168.69.247:35054 PA / Raw
Ether / IP / TCP 192.168.69.247:35054 > 162.159.136.234:https A
Ether / IP / TCP 162.159.136.234:https > 192.168.69.247:35054 PA / Raw
Ether / IP / TCP 162.159.136.234:https > 192.168.69.247:35054 PA / Raw
Ether / IP / TCP 162.159.136.234:https > 192.168.69.247:35054 PA / Raw
Ether / IP / TCP 192.168.69.247:35054 > 162.159.136.234:https A
Ether / IP / TCP 162.159.136.234:https > 192.168.69.247:35054 PA / Raw
Ether / IP / TCP 162.159.136.234:https > 192.168.69.247:35054 PA / Raw
Ether / IP / TCP 192.168.69.247:35054 > 162.159.136.234:https A
Ether / IP / TCP 162.159.136.234:https > 192.168.69.247:35054 PA / Raw
Ether / IP / TCP 162.159.136.234:https > 192.168.69.247:35054 PA / Raw
Ether / IP / TCP 162.159.136.234:https > 192.168.69.247:35054 PA / Raw
Ether / IP / TCP 192.168.69.247:35054 > 162.159.136.234:https A
Ether / IP / TCP 162.159.136.234:https > 192.168.69.247:35054 PA / Raw
Ether / IP / TCP 192.168.69.247:35054 > 162.159.136.234:https A
Ether / IP / TCP 162.159.136.234:https > 192.168.69.247:35054 PA / Raw
Ether / IP / TCP 192.168.69.247:35054 > 162.159.136.234:https A
Ether / IP / TCP 162.159.136.234:https > 192.168.69.247:35054 PA / Raw
Ether / IP / TCP 192.168.69.247:35054 > 162.159.136.234:https A
Ether / IP / TCP 162.159.136.234:https > 192.168.69.247:35054 PA / Raw
Ether / IP / TCP 192.168.69.247:35054 > 162.159.136.234:https A
Ether / IP / TCP 162.159.136.234:https > 192.168.69.247:35054 PA / Raw
Ether / IP / TCP 192.168.69.247:35054 > 162.159.136.234:https A
Ether / IP / TCP 162.159.136.234:https > 192.168.69.247:35054 PA / Raw
Ether / IP / TCP 192.168.69.247:35054 > 162.159.136.234:https A
Ether / IP / TCP 162.159.136.234:https > 192.168.69.247:35054 PA / Raw
Ether / IP / TCP 192.168.69.247:35054 > 162.159.136.234:https A
Ether / IP / TCP 162.159.136.234:https > 192.168.69.247:35054 PA / Raw
Ether / IP / TCP 192.168.69.247:35054 > 162.159.136.234:https A
Ether / IP / TCP 162.159.136.234:https > 192.168.69.247:35054 PA / Raw
Ether / IP / TCP 192.168.69.247:35054 > 162.159.136.234:https A
Ether / IP / TCP 192.168.69.247:xmsg > 192.168.69.197:57710 PA / Raw
Ether / IP / TCP 162.159.136.234:https > 192.168.69.247:35054 PA / Raw
Ether / IP / TCP 162.159.136.234:https > 192.168.69.247:35054 PA / Raw
Ether / IP / TCP 192.168.69.247:35054 > 162.159.136.234:https A
Ether / IP / TCP 192.168.69.197:57710 > 192.168.69.247:xmsg A
Ether / IP / TCP 162.159.136.234:https > 192.168.69.247:35054 PA / Raw
Ether / IP / TCP 192.168.69.247:35054 > 162.159.136.234:https A
Ether / IP / TCP 162.159.136.234:https > 192.168.69.247:35054 PA / Raw
Ether / IP / TCP 192.168.69.247:35054 > 162.159.136.234:https A
Ether / IP / TCP 162.159.136.234:https > 192.168.69.247:35054 PA / Raw
Ether / IP / TCP 162.159.136.234:https > 192.168.69.247:35054 PA / Raw
Ether / IP / TCP 192.168.69.247:35054 > 162.159.136.234:https A
Ether / IP / TCP 162.159.136.234:https > 192.168.69.247:35054 PA / Raw
Ether / IP / TCP 192.168.69.247:35054 > 162.159.136.234:https A
Ether / IP / TCP 162.159.136.234:https > 192.168.69.247:35054 PA / Raw
Ether / IP / TCP 192.168.69.247:35054 > 162.159.136.234:https A
